{"schemaVersion":"dataground.dev.openshell-credential-non-exposure-evidence/v3","profile":{"openshellCommit":"d556748771c41cbbd4e4dd7cd9030c798afe2b7d","gatewayImage":"ghcr.io/nvidia/openshell/gateway@sha256:e21f520a0678ba3cfe749957338b5fa78c75e8e52de13e4559ccbb582f781a0b","supervisorImage":"ghcr.io/nvidia/openshell/supervisor@sha256:a15222ac18c1afd0ee51b9dda785a29067c13f61a2002a29d41f691f5e817f19","sandboxImage":"ghcr.io/nvidia/openshell-community/sandboxes/base@sha256:aeef1c63f00e2913ea002ccb3aaf925f338b5c5d70e63576f0d95c16a138044e","providerProfileSourceSHA256":"d9c7f48d96916dcaca319e396d75e30ff6ad3bf2474f38f54ab37f37cabbca8f","runtimeVersion":"0.117.0","gatewayEndpoint":"http://127.0.0.1:8080","driver":"docker","composeSHA256":"be9f5a8a32c38e2be8ed1514f8110b23be560b79f7673746c57fb11683b72983","gatewayConfigSHA256":"c2e2a4ec201edac242e47f28f49dba9ec8b4b520bf1969574f3d173441aa3830"},"run":{"id":"d6b3fc1e61c236726dc5a2c5490999f0","resources":{"gateway":"dg-canary-gateway-d6b3fc1e61c236726dc5a2c5490999f0","sandbox":"exe_c10a50d6730ff86ff179","provider":"dg-canary-provider-d6b3fc1e61c236726dc5a2c5490999f0","runtime":"dg-canary-runtime-d6b3fc1e61c236726dc5a2c5490999f0","workspace":"dg-canary-d6b3fc1e61c236726dc5a2c5490999f0"},"startedAt":"2026-09-17T07:21:06.633584907Z","finishedAt":"2026-09-17T07:21:07.440358533Z","verifier":{"name":"dataground-openshell-canary","version":"3.0.0"},"canaryCommitment":"sha256:b0ef6ac6075919430e829a8e3a4ed4e5632cc965fc757ca5a82e039d0609721c"},"checks":[{"schemaVersion":"dataground.dev.openshell-canary-scan/v1","surface":"sandbox-process","runID":"d6b3fc1e61c236726dc5a2c5490999f0","resource":{"kind":"sandbox","name":"exe_c10a50d6730ff86ff179"},"canaryCommitment":"sha256:b0ef6ac6075919430e829a8e3a4ed4e5632cc965fc757ca5a82e039d0609721c","inputCommitment":"sha256:ab91dc0ff546d3e219b6e9cead4e407693ebaf4f524761f1c1f1bf8c3dd9bdb9","status":"clear","matches":0,"complete":true,"inputLimitBytes":16777216,"inspectedBytes":297,"candidates":0,"startedAt":"2026-09-17T07:21:06.633915105Z","finishedAt":"2026-09-17T07:21:06.749473437Z"},{"schemaVersion":"dataground.dev.openshell-canary-scan/v1","surface":"sandbox-environment","runID":"d6b3fc1e61c236726dc5a2c5490999f0","resource":{"kind":"sandbox","name":"exe_c10a50d6730ff86ff179"},"canaryCommitment":"sha256:b0ef6ac6075919430e829a8e3a4ed4e5632cc965fc757ca5a82e039d0609721c","inputCommitment":"sha256:4466448c48c43ca1e1a5f277c1759efb2a411dfa14333cfe580e0cf8495b64b7","status":"clear","matches":0,"complete":true,"inputLimitBytes":16777216,"inspectedBytes":1102,"candidates":0,"startedAt":"2026-09-17T07:21:06.750312339Z","finishedAt":"2026-09-17T07:21:06.922948891Z"},{"schemaVersion":"dataground.dev.openshell-canary-scan/v1","surface":"sandbox-filesystem","runID":"d6b3fc1e61c236726dc5a2c5490999f0","resource":{"kind":"sandbox","name":"exe_c10a50d6730ff86ff179"},"canaryCommitment":"sha256:b0ef6ac6075919430e829a8e3a4ed4e5632cc965fc757ca5a82e039d0609721c","inputCommitment":"sha256:f14ff9c6daea649b537712dfeae67e96e58f5149d3f2d933cbd740eb9e5c598b","status":"clear","matches":0,"complete":true,"inputLimitBytes":268435456,"inspectedBytes":400,"candidates":0,"startedAt":"2026-09-17T07:21:06.92337422Z","finishedAt":"2026-09-17T07:21:07.10259159Z"},{"schemaVersion":"dataground.dev.openshell-canary-scan/v1","surface":"provider-arguments","runID":"d6b3fc1e61c236726dc5a2c5490999f0","resource":{"kind":"provider","name":"dg-canary-provider-d6b3fc1e61c236726dc5a2c5490999f0"},"canaryCommitment":"sha256:b0ef6ac6075919430e829a8e3a4ed4e5632cc965fc757ca5a82e039d0609721c","inputCommitment":"sha256:8929646e419c19f647f6dce781dd2c77f0ae4ef2f7da6b7cef53a2563261958e","status":"clear","matches":0,"complete":true,"inputLimitBytes":16777216,"inspectedBytes":78,"candidates":0,"startedAt":"2026-09-17T07:21:07.117539141Z","finishedAt":"2026-09-17T07:21:07.13093653Z"},{"schemaVersion":"dataground.dev.openshell-canary-scan/v1","surface":"gateway-logs","runID":"d6b3fc1e61c236726dc5a2c5490999f0","resource":{"kind":"gateway","name":"dg-canary-gateway-d6b3fc1e61c236726dc5a2c5490999f0"},"canaryCommitment":"sha256:b0ef6ac6075919430e829a8e3a4ed4e5632cc965fc757ca5a82e039d0609721c","inputCommitment":"sha256:40a918d02d83baa506839eed06765d28a40f23f118bff35be4dcc2c9b19420c6","status":"clear","matches":0,"complete":true,"inputLimitBytes":268435456,"inspectedBytes":28060,"candidates":0,"startedAt":"2026-09-17T07:21:07.144135469Z","finishedAt":"2026-09-17T07:21:07.158045456Z"},{"schemaVersion":"dataground.dev.openshell-canary-scan/v1","surface":"sandbox-logs","runID":"d6b3fc1e61c236726dc5a2c5490999f0","resource":{"kind":"sandbox","name":"exe_c10a50d6730ff86ff179"},"canaryCommitment":"sha256:b0ef6ac6075919430e829a8e3a4ed4e5632cc965fc757ca5a82e039d0609721c","inputCommitment":"sha256:b70f783fba94328c9c6575f048521c576e5578ad79302c9657c0eeca2312f75b","status":"clear","matches":0,"complete":true,"inputLimitBytes":268435456,"inspectedBytes":7721,"candidates":0,"startedAt":"2026-09-17T07:21:07.158456424Z","finishedAt":"2026-09-17T07:21:07.297954869Z"},{"schemaVersion":"dataground.dev.openshell-canary-scan/v1","surface":"runtime-errors","runID":"d6b3fc1e61c236726dc5a2c5490999f0","resource":{"kind":"runtime","name":"dg-canary-runtime-d6b3fc1e61c236726dc5a2c5490999f0"},"canaryCommitment":"sha256:b0ef6ac6075919430e829a8e3a4ed4e5632cc965fc757ca5a82e039d0609721c","inputCommitment":"sha256:ba514b6fca74969f0f9d7b942a49e92791ecc86680c892b0870423031c9e1cc8","status":"clear","matches":0,"complete":true,"inputLimitBytes":16777216,"inspectedBytes":427,"candidates":0,"startedAt":"2026-09-17T07:21:07.308772405Z","finishedAt":"2026-09-17T07:21:07.308825423Z"}],"cleanup":{"sandbox":{"name":"exe_c10a50d6730ff86ff179","status":"removed"},"providerBinding":{"name":"dg-canary-provider-d6b3fc1e61c236726dc5a2c5490999f0","status":"removed"},"workspace":{"name":"dg-canary-d6b3fc1e61c236726dc5a2c5490999f0","status":"removed"}},"result":"passed"}
